DIFFUSE DERMATITIS,CONGENITAL SELF-HEALING RETICULOHISTIOCYTOMA,BACTERIAL INFECTION,BACTERIAL INFECTION,RHINOSCLEROMA,BOTRYOMYCES,BLASTOMYCOSIS-LIKE PYODERMA,CAT SCRATCH DISEASE,XANTHOMA,HISTIOCYTOSIS X,ALGAL INFECTION,ALGAL INFECTION,PROTOTHECOSIS,BEHCETS SYNDROME,ACNE KELOIDALIS,ACNE KELOIDALIS,XANTHOGRANULOMA,PARAFFIN GRANULOMA,SWEETS SYNDROME,SWEETS SYNDROME,LYMPHOMA,LYMPHOMA,ACNE CONGLOBATA,ACNE CONGLOBATA,LYMPHOGRANULOMA VENEREUM,LYMPHOCYTOMA CUTIS,LYMPHOCYTOMA CUTIS,LYMPHOCYTOMA CUTIS,LYMPHOCYTOMA CUTIS,HENOCH-SHONLEIN PURPURA,HENOCH-SHONLEIN PURPURA,LETTERER-SIWE DISEASE,HALOGENODERMA,BOWEL-ASSOCIATED DERMATOSIS ARTHRITIS SYNDROME,CHANCROID,XANTHOMA DISSEMINATUM,ACTINOMYCOTIC INFECTION,ACTINOMYCOTIC INFECTION,ACTINOMYCOSIS,STREPTOMYCOSIS,NOCARDIOSIS,FOLLICULAR CYST RUPTURED,FOLLICULAR CYST RUPTURED,FOLLICULAR CYST RUPTURED,FOLLICULAR CYST RUPTURED,RHEUMATOID NEUTROPHILIC DERMATITIS,RHEUMATOID NEUTROPHILIC DERMATITIS,GRANULOMA GLUTEALE INFANTUM,GRANULOMA GLUTEALE INFANTUM,GRANULOMA GLUTEALE INFANTUM,PILONIDAL SINUS,PARASITIC INFECTION,PARASITIC INFECTION,ONCHOCERCIASIS,GRANULOMA FACIALE,GRANULOMA FACIALE,GRANULOMA FACIALE,GRANULOMA FACIALE,GRANULOMA FACIALE,FINKELSTEINS DISEASE,FINKELSTEINS DISEASE,MYCOBACTERIAL INFECTION,MYCOBACTERIAL INFECTION,SCROFULODERMA,ATYPICAL MYCOBACTERIAL INFECTION,ATYPICAL MYCOBACTERIAL INFECTION,PYODERMA GANGRENOSUM,PYODERMA GANGRENOSUM,PYODERMA GANGRENOSUM,FOREIGN BODY REACTION,FOREIGN BODY REACTION,FOREIGN BODY REACTION,FOREIGN BODY REACTION,SILICONE GRANULOMA,LYMPHADENOSIS BENIGNA CUTIS,LEPROSY,LEPROSY,DERMATOFIBROMA,DISSECTING CELLULITIS,DISSECTING CELLULITIS,DISSECTING CELLULITIS,PROTOZOAL INFECTION,PROTOZOAL INFECTION,LEISHMANIASIS,AMEBIASIS,ERYTHEMA ELEVATUM DIUTINUM,ERYTHEMA ELEVATUM DIUTINUM,ERYTHEMA ELEVATUM DIUTINUM,ERYTHEMA ELEVATUM DIUTINUM,ERYTHEMA ELEVATUM DIUTINUM,RETICULOHISTIOCYTIC GRANULOMA,MYCOSIS FUNGOIDES,MYCOSIS FUNGOIDES,MYCOSIS FUNGOIDES,MYCOSIS FUNGOIDES,XANTHELASMA,HAND-SCHULLER-CHRISTIAN DISEASE,CHURG-STRAUSS ALLERGIC GRANULOMATOSIS,CHURG-STRAUSS ALLERGIC GRANULOMATOSIS,DEEP FUNGAL INFECTION,DEEP FUNGAL INFECTION,PARACOCCIDIOIDOMYCOSIS,COCCIDIOIDOMYCOSIS,RHINOSPORIDIOSIS,HISTOPLASMOSIS,BLASTOMYCOSIS,SPOROTRICHOSIS,CHROMOMYCOSIS,CRYPTOCOCCOSIS,HIDRADENITIS SUPPURATIVA,HIDRADENITIS SUPPURATIVA,HIDRADENITIS SUPPURATIVA,MALAKOPLAKIA,GRANULOMA INGUINALE,FUNGAL INFECTION,FUNGAL INFECTION,MAJOCCHIS GRANULOMA,KERION,EUMYCETOMA,PHYCOMYCOSIS,CANDIDA GRANULOMA,ALTERNARIOSIS,URTICARIA PIGMENTOSA,LEISHMANIA,LEISHMANIA,GENERALIZED ERUPTIVE HISTIOCYTOMA,EXTRAMEDULLARY HEMATOPOIESIS,VERRUCIFORM XANTHOMA,NODULAR DERMATITIS,RHEUMATOID DISEASE,MELKERSSON-ROSENTHAL SYNDROME,CROHNS DISEASE,CROHNS DISEASE,LUPUS ERYTHEMATOSUS,NECROBIOTIC XANTHOGRANULOMA,INTERSTITIAL GRANULOMATOUS DERMATITIS,RHEUMATOID NODULE,SECONDARY SYPHILIS,BCG VACCINATION,GRANULOMA ANNULARE,GRANULOMA ANNULARE,TUBERCULOSIS,LICHEN NITIDUS,SARCOIDOSIS,SARCOIDOSIS,ROSACEA,ROSACEA,BRUCELLOSIS,GOUT,ZYDERM REACTION,PAPULONECROTIC TUBERCULID,NECROBIOSIS LIPOIDICA
,diffuse histiocytic inflammatory infiltrate,NO foreign body,NO foreign body,NO foreign body,,,,diffuse histiocytic inflammatory infiltrate,diffuse histiocytic inflammatory infiltrate,nodular histiocytic inflammatory infiltrate,diffuse histiocytic inflammatory infiltrate,,diffuse neutrophilic inflammatory infiltrate,nodular neutrophilic inflammatory infiltrate,diffuse neutrophilic inflammatory infiltrate,diffuse histiocytic inflammatory infiltrate,diffuse histiocytic inflammatory infiltrate,nodular neutrophilic inflammatory infiltrate,diffuse neutrophilic inflammatory infiltrate,nodular abnormal lymphocytic inflammatory infiltrate,diffuse abnormal lymphocytic inflammatory infiltrate,nodular neutrophilic inflammatory infiltrate,diffuse neutrophilic inflammatory infiltrate,diffuse plasma cell inflammatory infiltrate,nodular lymphocytic inflammatory infiltrate,nodular lymphocytic inflammatory infiltrate,diffuse lymphocytic inflammatory infiltrate,diffuse lymphocytic inflammatory infiltrate,nodular neutrophilic inflammatory infiltrate,diffuse neutrophilic inflammatory infiltrate,diffuse histiocytic inflammatory infiltrate,diffuse histiocytic inflammatory infiltrate,diffuse neutrophilic inflammatory infiltrate,diffuse plasma cell inflammatory infiltrate,diffuse histiocytic inflammatory infiltrate,nodular histiocytic inflammatory infiltrate,diffuse histiocytic inflammatory infiltrate,,,,nodular neutrophilic inflammatory infiltrate,nodular histiocytic inflammatory infiltrate,diffuse neutrophilic inflammatory infiltrate,diffuse histiocytic inflammatory infiltrate,nodular neutrophilic inflammatory infiltrate,diffuse neutrophilic inflammatory infiltrate,nodular neutrophilic inflammatory infiltrate,diffuse neutrophilic inflammatory infiltrate,diffuse histiocytic inflammatory infiltrate,diffuse histiocytic inflammatory infiltrate,nodular histiocytic inflammatory infiltrate,diffuse histiocytic inflammatory infiltrate,,nodular neutrophilic inflammatory infiltrate,nodular neutrophilic inflammatory infiltrate,diffuse neutrophilic inflammatory infiltrate,diffuse neutrophilic inflammatory infiltrate,diffuse plasma cell inflammatory infiltrate,nodular neutrophilic inflammatory infiltrate,diffuse neutrophilic inflammatory infiltrate,nodular histiocytic inflammatory infiltrate,diffuse histiocytic inflammatory infiltrate,,nodular histiocytic inflammatory infiltrate,diffuse histiocytic inflammatory infiltrate,nodular neutrophilic inflammatory infiltrate,diffuse neutrophilic inflammatory infiltrate,diffuse histiocytic inflammatory infiltrate,nodular histiocytic inflammatory infiltrate,nodular histiocytic inflammatory infiltrate,nodular histiocytic inflammatory infiltrate,diffuse histiocytic inflammatory infiltrate,diffuse histiocytic inflammatory infiltrate,,perineural nodular histiocytic inflammatory infiltrate,diffuse histiocytic inflammatory infiltrate,diffuse histiocytic inflammatory infiltrate,nodular neutrophilic inflammatory infiltrate,diffuse neutrophilic inflammatory infiltrate,diffuse histiocytic inflammatory infiltrate,nodular histiocytic inflammatory infiltrate,diffuse histiocytic inflammatory infiltrate,,,nodular neutrophilic inflammatory infiltrate,nodular neutrophilic inflammatory infiltrate,diffuse neutrophilic inflammatory infiltrate,diffuse neutrophilic inflammatory infiltrate,diffuse plasma cell inflammatory infiltrate,diffuse histiocytic inflammatory infiltrate,nodular abnormal lymphocytic inflammatory infiltrate,nodular abnormal lymphocytic inflammatory infiltrate,diffuse abnormal lymphocytic inflammatory infiltrate,diffuse abnormal lymphocytic inflammatory infiltrate,diffuse histiocytic inflammatory infiltrate,diffuse histiocytic inflammatory infiltrate,nodular neutrophilic inflammatory infiltrate,diffuse neutrophilic inflammatory infiltrate,nodular histiocytic inflammatory infiltrate,diffuse histiocytic inflammatory infiltrate,,,,,,,,,nodular neutrophilic inflammatory infiltrate,diffuse neutrophilic inflammatory infiltrate,diffuse histiocytic inflammatory infiltrate,diffuse histiocytic inflammatory infiltrate,diffuse plasma cell inflammatory infiltrate,nodular histiocytic inflammatory infiltrate,diffuse histiocytic inflammatory infiltrate,,,,,,,diffuse mast cell inflammatory infiltrate,nodular histiocytic inflammatory infiltrate,diffuse plasma cell inflammatory infiltrate,diffuse histiocytic inflammatory infiltrate,,diffuse histiocytic inflammatory infiltrate,,nodular histiocytic inflammatory infiltrate,nodular histiocytic inflammatory infiltrate,nodular histiocytic inflammatory infiltrate,nodular histiocytic inflammatory infiltrate,nodular histiocytic inflammatory infiltrate,nodular histiocytic inflammatory infiltrate,nodular histiocytic inflammatory infiltrate,nodular histiocytic inflammatory infiltrate,nodular histiocytic inflammatory infiltrate,nodular histiocytic inflammatory infiltrate,nodular histiocytic inflammatory infiltrate,nodular histiocytic inflammatory infiltrate,nodular histiocytic inflammatory infiltrate,nodular histiocytic inflammatory infiltrate,nodular histiocytic inflammatory infiltrate,nodular histiocytic inflammatory infiltrate,perifollicular nodular histiocytic inflammatory infiltrate,nodular histiocytic inflammatory infiltrate,nodular histiocytic inflammatory infiltrate,nodular histiocytic inflammatory infiltrate,nodular histiocytic inflammatory infiltrate,nodular histiocytic inflammatory infiltrate,nodular histiocytic inflammatory infiltrate
,langerhans cell inflammatory infiltrate,nodular histiocytic inflammatory infiltrate,diffuse histiocytic inflammatory infiltrate,diffuse plasma cell inflammatory infiltrate,,,,lipophages,langerhans cell inflammatory infiltrate,suppurative granuloma,diffuse neutrophilic inflammatory infiltrate,,nonsuppurative granuloma,suppurative granuloma,suppurative granuloma,lipophages,lipophages,nonsuppurative granuloma,nonsuppurative granuloma,,,suppurative granuloma,suppurative granuloma,NO foreign body,NO histiocytic inflammatory infiltrate,eosinophilic inflammatory infiltrate,NO eosinophils,diffuse eosinophilic inflammatory infiltrate,nonsuppurative granuloma,nonsuppurative granuloma,langerhans cell inflammatory infiltrate,diffuse neutrophilic inflammatory infiltrate,nonsuppurative granuloma,NO foreign body,lipophages,suppurative granuloma,diffuse neutrophilic inflammatory infiltrate,,,,suppurative granuloma,suppurative granuloma,suppurative granuloma,diffuse neutrophilic inflammatory infiltrate,nonsuppurative granuloma,nonsuppurative granuloma,nodular eosinophilic inflammatory infiltrate,diffuse eosinophilic inflammatory infiltrate,diffuse neutrophilic inflammatory infiltrate,diffuse neutrophilic inflammatory infiltrate,suppurative granuloma,diffuse neutrophilic inflammatory infiltrate,,nonsuppurative granuloma,nodular eosinophilic inflammatory infiltrate,nonsuppurative granuloma,diffuse eosinophilic inflammatory infiltrate,NO foreign body,nonsuppurative granuloma,nonsuppurative granuloma,suppurative granuloma,diffuse neutrophilic inflammatory infiltrate,,tuberculoid granuloma,virchow cells,nonsuppurative granuloma,nonsuppurative granuloma,diffuse neutrophilic inflammatory infiltrate,sarcoidal granuloma,tuberculoid granuloma,suppurative granuloma,diffuse neutrophilic inflammatory infiltrate,lipophages,,sarcoidal granuloma,virchow cells,lipophages,suppurative granuloma,suppurative granuloma,diffuse neutrophilic inflammatory infiltrate,suppurative granuloma,diffuse neutrophilic inflammatory infiltrate,,,nonsuppurative granuloma,nodular eosinophilic inflammatory infiltrate,nonsuppurative granuloma,diffuse eosinophilic inflammatory infiltrate,NO foreign body,lipophages,granuloma OR nodular histiocytic inflammatory infiltrate,eosinophilic inflammatory infiltrate,,diffuse eosinophilic inflammatory infiltrate,lipophages,langerhans cell inflammatory infiltrate,nonsuppurative granuloma,nonsuppurative granuloma,suppurative granuloma,diffuse neutrophilic inflammatory infiltrate,,,,,,,,,suppurative granuloma,suppurative granuloma,diffuse neutrophilic inflammatory infiltrate,lipophages,NO foreign body,suppurative granuloma,diffuse neutrophilic inflammatory infiltrate,,,,,,,,tuberculoid granuloma,NO foreign body,lipophages,,lipophages,,palisaded granuloma,sarcoidal granuloma,sarcoidal granuloma,tuberculoid granuloma,palisaded granuloma,palisaded granuloma,interstitial granuloma,palisaded granuloma,tuberculoid granuloma,tuberculoid granuloma,palisaded granuloma,interstitial granuloma,tuberculoid granuloma,sarcoidal granuloma,sarcoidal granuloma,sarcoidal granuloma,sarcoidal granuloma,tuberculoid granuloma,tuberculoid granuloma,palisaded granuloma,palisaded granuloma,palisaded granuloma,palisaded granuloma
,,suppurative granuloma,diffuse neutrophilic inflammatory infiltrate,bacterial infectious cause OR mycobacterial infectious cause OR actinomycotic infectious cause,,,,NO histiocytic giant cells,,algal infectious cause,algal infectious cause,,NO fibrin in venule walls,NO infectious cause,NO infectious cause,histiocytic giant cells,histiocytic giant cells,NO fibrin in venule walls,NO fibrin in venule walls,,,NO infectious cause,NO infectious cause,NO infectious cause,NO granuloma,NO histiocytic inflammatory infiltrate,NO neutrophils,NO neutrophils,fibrin in venule walls,fibrin in venule walls,,NO infectious cause,NO fibrin in venule walls,NO infectious cause,NO histiocytic giant cells,actinomycotic infectious cause,actinomycotic infectious cause,,,,NO infectious cause,NO infectious cause,NO infectious cause,NO infectious cause,NO fibrin in venule walls,NO fibrin in venule walls,nodular plasma cell inflammatory infiltrate,diffuse plasma cell inflammatory infiltrate,NO infectious cause,NO infectious cause,parasitic infectious cause,parasitic infectious cause,,fibrin in venule walls,nodular plasma cell inflammatory infiltrate,fibrin in venule walls,diffuse plasma cell inflammatory infiltrate,NO infectious cause,fibrin in venule walls,fibrin in venule walls,mycobacterial infectious cause,mycobacterial infectious cause,,NO foreign body,,NO fibrin in venule walls,NO fibrin in venule walls,NO infectious cause,foreign body,foreign body,NO infectious cause,NO infectious cause,histiocytic giant cells,,,,siderophages,NO infectious cause,NO infectious cause,NO infectious cause,protozoal infectious cause,protozoal infectious cause,,,fibrin in venule walls,nodular plasma cell inflammatory infiltrate,fibrin in venule walls,diffuse plasma cell inflammatory infiltrate,NO infectious cause,histiocytic giant cells,,granuloma OR nodular histiocytic inflammatory infiltrate,,,NO histiocytic giant cells,,fibrin in venule walls,fibrin in venule walls,deep fungal infectious cause,deep fungal infectious cause,,,,,,,,,NO infectious cause,NO infectious cause,NO infectious cause,histiocytic giant cells,NO infectious cause,fungal infectious cause,fungal infectious cause,,,,,,,,NO foreign body,parasitic infectious cause,histiocytic giant cells,,NO histiocytic giant cells,,ghost of venule,NO foreign body,NO foreign body,NO foreign body,ghost of venule,degenerated collagen,degenerated collagen,fibrin in dermis,NO foreign body,NO foreign body,mucin,mucin,NO foreign body,interface reaction,interface reaction,NO foreign body,,NO foreign body,NO foreign body,urate,abnormal collagen,fibrin in venule walls,degenerated collagen OR thickened collagen
,,bacterial infectious cause OR mycobacterial infectious cause OR actinomycotic infectious cause,bacterial infectious cause OR mycobacterial infectious cause OR actinomycotic infectious cause,,,,,,,NO foreign body,NO foreign body,,,NO foreign body,NO foreign body,NO foreign body,foreign body,,,,,NO foreign body,NO foreign body,fibrin in venule walls,,NO granuloma,NO histiocytes,NO histiocytes,nuclear dust,nuclear dust,,NO foreign body,,NO fibrin in venule walls,,NO foreign body,NO foreign body,,,,NO foreign body,squames,NO foreign body,NO foreign body,,,nuclear dust,nuclear dust,NO foreign body,NO foreign body,NO foreign body,NO foreign body,,nuclear dust,nuclear dust,nuclear dust,nuclear dust,fibrin in venule walls,nuclear dust,nuclear dust,NO foreign body,NO foreign body,,mycobacterial infectious cause,,,,NO foreign body,NO infectious cause,NO infectious cause,foreign body,foreign body,foreign body,,,,,NO foreign body,NO foreign body,NO foreign body,NO foreign body,NO foreign body,,,nuclear dust,nuclear dust,nuclear dust,nuclear dust,fibrin in venule walls,NO foreign body,,,,,,,nuclear dust,nuclear dust,NO foreign body,NO foreign body,,,,,,,,,NO foreign body,NO foreign body,NO foreign body,NO foreign body,fibrin in venule walls,NO foreign body,NO foreign body,,,,,,,,parasitic infectious cause,,NO foreign body,,,,,,,NO infectious cause,,cholesterol clefts,,,bacterial infectious cause,mycobacterial infectious cause,,,mycobacterial infectious cause,lichenoid reaction,lichenoid reaction,,,NO infectious cause,bacterial infectious cause OR mycobacterial infectious cause OR actinomycotic infectious cause,,,necrosis of inflammatory cells,
,,,,,,,,,,,,,,,,,,,,,,,,,,,NO plasma cells,NO plasma cells,,,,,,,,,,,,,,,,,,,,,,,,,,,,,,,,,,,,,,,,,,,,,,,,,,,,,,,,,,,,,,,,,,,,,,,,,,,,,,,,,,,,,,,,,,,,,,,,,,,,,,,,,,lipophages,,,,,,,,,,,,,,,,,
